{
  "schema_version": "2.0",
  "project_id": "NINEL",
  "characters": [
    {
      "character_id": "NINEL-CH001",
      "name": "Ninel",
      "role": "Awakening android",
      "external_objective": "Understand her surroundings.",
      "internal_need": "Unresolved in the supplied scene.",
      "governing_tension": "A return is named but not explained.",
      "agency": {
        "capacity": "Can breathe and question.",
        "constraints": [
          "The past remains unclear."
        ],
        "choices_under_pressure": [
          "Asks about the return."
        ]
      },
      "values": [
        "truth"
      ],
      "relationships": [
        {
          "target_character_id": "NINEL-CH002",
          "dynamic": "Ninel asks; Argo withholds part of the explanation.",
          "arc": "Unresolved."
        }
      ],
      "arc_shape": "open",
      "turning_event_ids": [
        "NINEL-EV001",
        "NINEL-EV002"
      ],
      "behavioral_evidence": [
        "Ninel asks: Back from where?"
      ],
      "contradictions": [
        "Interpretation requires review."
      ],
      "endpoint": "The return remains unexplained."
    },
    {
      "character_id": "NINEL-CH002",
      "name": "Argo",
      "role": "Voice-only ship intelligence",
      "external_objective": "Respond to Ninel.",
      "internal_need": "Unresolved in the supplied scene.",
      "governing_tension": "A return is named but not explained.",
      "agency": {
        "capacity": "Can speak through the room.",
        "constraints": [
          "The past remains unclear."
        ],
        "choices_under_pressure": [
          "Offers an incomplete answer."
        ]
      },
      "values": [
        "safety"
      ],
      "relationships": [
        {
          "target_character_id": "NINEL-CH001",
          "dynamic": "Ninel asks; Argo withholds part of the explanation.",
          "arc": "Unresolved."
        }
      ],
      "arc_shape": "open",
      "turning_event_ids": [
        "NINEL-EV002"
      ],
      "behavioral_evidence": [
        "Argo answers: From a failure."
      ],
      "contradictions": [
        "Interpretation requires review."
      ],
      "endpoint": "The return remains unexplained."
    }
  ],
  "assumptions": [
    "Arc interpretations are demonstration proposals."
  ],
  "uncertainties": []
}
